{
  "$schema": "http://json-schema.org/draft-07/schema#",
  "title": "Flora",
  "type": "object",
  "required": [
    "id",
    "type",
    "name",
    "growth_form"
  ],
  "properties": {
    "id": {
      "type": "string",
      "pattern": "^flora_[a-z0-9_]+$"
    },
    "type": {
      "const": "flora"
    },
    "name": {
      "type": "string"
    },
    "scientific": {
      "type": [
        "string",
        "null"
      ]
    },
    "growth_form": {
      "type": "string",
      "enum": [
        "tree",
        "palm",
        "shrub",
        "vine",
        "flower",
        "grass",
        "root",
        "fern",
        "moss",
        "lichen",
        "cactus",
        "seaweed",
        "coral",
        "pitcher"
      ],
      "description": "What shape the plant takes, from database/growth_forms.json. The companion to `clade` on fauna, and required for the same reason: a species that does not say what it is sends the game back to guessing from its name, which is how `Saltreed` became a tree."
    },
    "taxonomy": {
      "type": "object"
    },
    "habitats": {
      "type": "array",
      "items": {
        "type": "string"
      }
    },
    "uses": {
      "type": "array",
      "items": {
        "type": "string",
        "enum": [
          "food",
          "seasoning",
          "drink",
          "psychoactive",
          "physic",
          "poison",
          "timber",
          "craftwork",
          "fibre",
          "fuel",
          "oil",
          "dye",
          "fragrance",
          "trade",
          "ritual",
          "memory",
          "shade",
          "ornament",
          "boundary",
          "landmark",
          "filtration"
        ]
      },
      "description": "What people do with this plant, from database/plant_uses.json. **Not what it is made of** -- a material class says what you can carry away and a use says what the plant is for, and more than half of these are not substances: nobody carries away shade, a boundary, or a tree they steer by. See material_classes.json for the other question.\n\nDeclared late. It ran to 51 free-text values across 27 plants, 44 of them used exactly once, which is what an undeclared vocabulary looks like from the inside."
    },
    "related_species": {
      "type": "array",
      "items": {
        "type": "string"
      }
    },
    "notes": {
      "type": "string"
    },
    "canon": {
      "type": "string",
      "enum": [
        "primary",
        "secondary",
        "draft"
      ],
      "default": "primary"
    },
    "sources": {
      "type": "array",
      "items": {
        "type": "string"
      }
    },
    "journal_prompt": {
      "type": "string",
      "description": "Player-facing prose read in the travel journal. Distinct from `notes`: `notes` is a reference fact for the canon reader, `journal_prompt` is the sentence the player sees. Exported as `journalPrompt`."
    },
    "region": {
      "type": "string",
      "enum": [
        "saraswati-godavari-deltas",
        "narmada-vindhya",
        "gedrosian-taklamakan",
        "shattered-sea-mappa-mundi",
        "ganges-lava-sea",
        "tethys-sky-routes",
        "asura-conjurations",
        "prototype-starters"
      ],
      "description": "Bestiary region of origin, kept for provenance."
    },
    "biomes": {
      "type": "array",
      "description": "Where this species lives, from the canonical vocabulary in database/biomes.json. Wider than the game's biome set on purpose: canon can say 'floating island' or 'Naraka rifts' even though the walk has nowhere to put them. The export keeps only the renderable ones, and a species left with none becomes placement 'lore' automatically. An empty list means nobody has tagged this yet -- say where it lives instead.",
      "items": {
        "type": "string",
        "enum": [
          "sea",
          "coast",
          "plains",
          "forest",
          "wetland",
          "hills",
          "mountains",
          "snow",
          "desert",
          "river",
          "settlement",
          "landmark",
          "sky_island",
          "sky_underside",
          "sky_water",
          "open_sky",
          "underworld",
          "lava_field"
        ]
      }
    },
    "placement": {
      "type": "string",
      "enum": [
        "encounter",
        "flavour",
        "lore"
      ],
      "description": "Whether the species can be met (`encounter`), only mentioned in passing (`flavour`), or exists in the record alone (`lore`)."
    },
    "rarity": {
      "type": "string",
      "enum": [
        "common",
        "rare",
        "mythic"
      ],
      "description": "How often a player meets one. Drives the weighting the game expands biome pools with, so a fourth value silently changes encounter rates."
    },
    "epochs": {
      "type": "array",
      "items": {
        "type": "string"
      },
      "description": "Epoch ids from database/timeline/epochs.json. Absent means present in all epochs."
    },
    "source_index": {
      "type": "integer",
      "minimum": 0,
      "description": "Position in the authored bestiary sequence (prototype starters first for fauna). Array order decides which species pickFor lands on for a tile, so this is part of the seed contract, not presentation."
    },
    "placement_note": {
      "type": "string",
      "description": "Why this species is placed as it is, when the answer is not obvious. Required reading before 'fixing' an entity with empty `biomes`: an empty list can mean untagged, or it can mean deliberately held out of play. If this field is present, the emptiness is a decision."
    },
    "crosses_at": {
      "type": "array",
      "items": {
        "type": "string"
      },
      "description": "Entity ids where this plant's story crosses another's -- an event, a settlement. Resolved by the reference walker rather than here. Typed as a string on the first attempt at this schema, which the two flora carrying it immediately disproved."
    },
    "aliases": {
      "type": "array",
      "items": {
        "type": "string"
      },
      "description": "Other names this plant is known by. Fauna has carried this field for as long as the schema has and flora never did, which was an asymmetry with no argument behind it -- a plant is at least as likely to have a second name as an animal, and rather more likely where the vernacular and the botanical name are both in daily use.\n\nIt was noticed the way these things are: somebody asked for nux-vomica, canon held it under `Kuchla`, and the apothecary printed no binomial -- so a plant that was there could not be found by the only name the reader had for it."
    },
    "appearance": {
      "type": "string",
      "minLength": 20,
      "description": "What it looks like, in prose a painter can work from: the body, colour and texture, not the pose. Canon's record for the books and the art plan; withheld from the game's bundle, which never reads it."
    }
  },
  "additionalProperties": false
}
