{
  "id": "flora_red_blood_coral",
  "type": "flora",
  "name": "Red Blood-Coral",
  "scientific": "Tethysolithus rubra",
  "growth_form": "coral",
  "region": "shattered-sea-mappa-mundi",
  "biomes": [
    "sea"
  ],
  "placement": "flavour",
  "rarity": "common",
  "journal_prompt": "An aggressive, fast-growing coral polyp that builds fossilized ridges and reclaims ancient stone aqueducts in the marshes.",
  "canon": "primary",
  "sources": [
    "docs/bestiary.md",
    "docs/lore/lorework-2026-09-29.md"
  ],
  "source_index": 30,
  "appearance": "A fast-growing, reef-building polyp that raises interlocking, finger-like lattice arches and dense, jagged wall-crusts in vivid vermilion, furred with velvety scarlet polyps."
}
