{
  "id": "flora_crimson_blood_weed",
  "type": "flora",
  "name": "Crimson Blood-Weed",
  "scientific": "Vitis asurica",
  "growth_form": "vine",
  "region": "asura-conjurations",
  "biomes": [
    "forest"
  ],
  "placement": "flavour",
  "rarity": "mythic",
  "journal_prompt": "An invasive, predatory vine mutated by the bleeding energies of Asura planets, developing pulsing veins and a hunger for flesh.",
  "canon": "primary",
  "sources": [
    "docs/bestiary.md"
  ],
  "source_index": 62
}
