{
  "id": "flora_lodestone_moss",
  "type": "flora",
  "name": "Lodestone Moss",
  "scientific": "Bryum magneticum",
  "growth_form": "moss",
  "region": "tethys-sky-routes",
  "biomes": [
    "sky_island",
    "sky_underside"
  ],
  "placement": "flavour",
  "rarity": "rare",
  "journal_prompt": "A dense, dark green moss that covers the magnetized cores of the floating islands, aligning its spores with the Earth's magnetic poles, and it grows down over the rim onto the underside where the ore is bare.",
  "canon": "primary",
  "sources": [
    "docs/bestiary.md"
  ],
  "source_index": 59,
  "placement_note": "Placeable since the sky tiles were painted. **`flavour` rather than `encounter`, because that is what the game reads for a plant** -- `species.ts` indexes flora by `flavour` and fauna by `encounter`, since a plant is something you find growing rather than somebody you meet. Promoting these to `encounter` first put them in the bundle and left `floraIn` empty, which the game's own coverage test caught."
}
