{
  "id": "flora_obsidian_rose",
  "type": "flora",
  "name": "Obsidian Rose",
  "scientific": "Rosa obsidiana",
  "growth_form": "flower",
  "region": "asura-conjurations",
  "biomes": [
    "settlement"
  ],
  "placement": "flavour",
  "rarity": "mythic",
  "journal_prompt": "A rose bush with razor-sharp black petals that secrete a deadly coagulant, growing in the ruins of desecrated temples.",
  "canon": "primary",
  "sources": [
    "docs/bestiary.md"
  ],
  "source_index": 68
}
