{
  "id": "flora_sun_catcher_herb",
  "type": "flora",
  "name": "Sun-Catcher Herb",
  "scientific": "Glassa solis",
  "growth_form": "shrub",
  "region": "tethys-sky-routes",
  "biomes": [
    "sky_island"
  ],
  "placement": "flavour",
  "rarity": "rare",
  "journal_prompt": "A silicate-absorbing plant with leaves that mirror stained glass, concentrating golden sunlight for deep-time healing.",
  "canon": "primary",
  "sources": [
    "docs/bestiary.md"
  ],
  "source_index": 55,
  "placement_note": "Placeable since the sky tiles were painted. **`flavour` rather than `encounter`, because that is what the game reads for a plant** -- `species.ts` indexes flora by `flavour` and fauna by `encounter`, since a plant is something you find growing rather than somebody you meet. Promoting these to `encounter` first put them in the bundle and left `floraIn` empty, which the game's own coverage test caught."
}
