{
  "id": "flora_whisper_fig",
  "type": "flora",
  "name": "Whisper-Fig",
  "scientific": "Ficus susurrans",
  "growth_form": "tree",
  "habitats": [
    "region_saraswati_delta",
    "canopy"
  ],
  "uses": [
    "shade",
    "ritual"
  ],
  "notes": "Broad-leafed fig whose hollow trunks carry wind as a low murmur. Delta dwellers treat unusual patterns of sound as weather or spirit omens. Read for omens.",
  "canon": "primary",
  "sources": [
    "SouthOfTethys.txt"
  ],
  "biomes": [
    "forest",
    "landmark"
  ],
  "placement": "flavour",
  "rarity": "rare",
  "journal_prompt": "The fig's trunk is hollow, and the wind moving through it makes a low sound that the delta people are careful not to interrupt."
}
